{
  "$schema": "../../schemas/mod-manifest.schema.json",
  "id": "example.round-budget",
  "name": "Round Budget",
  "author": "BTD5 Mod Loader contributors",
  "version": "1.0.0",
  "entry_point": "lua/main.lua",
  "loader_api": 1,
  "supported_game_builds": ["steam-win32-4.8"],
  "dependencies": [],
  "load_order": { "before": [], "after": [] },
  "capabilities": ["gameplay.events", "gameplay.mutate"],
  "configuration_defaults": { "enabled": false, "round_cash": 1000 },
  "documentation": "README.md"
}
