{
  "$schema": "../../schemas/mod-manifest.schema.json",
  "id": "example.event-monitor",
  "name": "Event Monitor",
  "author": "BTD5 Mod Loader contributors",
  "version": "1.0.1",
  "entry_point": "lua/main.lua",
  "loader_api": 1,
  "supported_game_builds": ["steam-win32-4.8"],
  "dependencies": [],
  "load_order": { "before": [], "after": [] },
  "capabilities": ["gameplay.events", "storage"],
  "configuration_defaults": {
    "log_each_action": false
  },
  "documentation": "README.md"
}
